{
    "version": "1.0",
    "platform": "telegram",
    "render_rules": {
        "max_buttons_per_row": 2,
        "max_rows": 3,
        "use_inline_keyboard": true,
        "use_reply_keyboard": false,
        "confirmation_required_for": [
            "danger",
            "state_change"
        ]
    },
    "components": {
        "main_entry": {
            "type": "inline_keyboard",
            "layout": [
                [
                    {
                        "text": "üìã –ó–∞–¥–∞—á–∏",
                        "action_id": "employee.show_my_tasks"
                    },
                    {
                        "text": "üóì –ì—Ä–∞—Ñ–∏–∫",
                        "action_id": "employee.show_my_schedule"
                    }
                ],
                [
                    {
                        "text": "üéØ –§–æ–∫—É—Å",
                        "action_id": "utility.focus_mode"
                    }
                ]
            ]
        },
        "tasks_list_actions": {
            "type": "inline_keyboard",
            "layout": [
                [
                    {
                        "text": "üîç –î–µ—Ç–∞–ª–∏",
                        "action_id": "utility.task_details"
                    },
                    {
                        "text": "‚ö†Ô∏è –ü—Ä–æ–±–ª–µ–º–∞",
                        "action_id": "utility.problem_report"
                    }
                ]
            ]
        },
        "task_details_actions": {
            "type": "inline_keyboard",
            "layout": [
                [
                    {
                        "text": "‚úÖ –ó–∞–≤–µ—Ä—à–µ–Ω–æ",
                        "action_id": "employee.confirm_task_done",
                        "style": "primary"
                    }
                ],
                [
                    {
                        "text": "‚ö†Ô∏è –°–æ–æ–±—â–∏—Ç—å –æ –ø—Ä–æ–±–ª–µ–º–µ",
                        "action_id": "utility.problem_report"
                    }
                ]
            ]
        },
        "confirmation_yes_no": {
            "type": "inline_keyboard",
            "layout": [
                [
                    {
                        "text": "‚úÖ –î–∞",
                        "action_id": "utility.yes_confirm",
                        "style": "danger"
                    },
                    {
                        "text": "‚ùå –û—Ç–º–µ–Ω–∞",
                        "action_id": "utility.cancel"
                    }
                ]
            ]
        },
        "problem_type_selector": {
            "type": "inline_keyboard",
            "layout": [
                [
                    {
                        "text": "üõ† –¢–µ—Ö–Ω–∏–∫–∞",
                        "action_id": "utility.problem_tech"
                    },
                    {
                        "text": "üë§ –ö–ª–∏–µ–Ω—Ç",
                        "action_id": "utility.problem_client"
                    }
                ],
                [
                    {
                        "text": "üìã –ó–∞–¥–∞—á–∞",
                        "action_id": "utility.problem_task"
                    },
                    {
                        "text": "‚ùì –î—Ä—É–≥–æ–µ",
                        "action_id": "utility.problem_other"
                    }
                ]
            ]
        },
        "shift_actions": {
            "type": "inline_keyboard",
            "layout": [
                [
                    {
                        "text": "üí¨ –ö–æ–º–º–µ–Ω—Ç–∞—Ä–∏–π",
                        "action_id": "employee.comment_shift"
                    }
                ]
            ]
        },
        "status_actions": {
            "type": "inline_keyboard",
            "layout": [
                [
                    {
                        "text": "üìà –ü—Ä–æ–≥—Ä–µ—Å—Å",
                        "action_id": "employee.show_my_progress"
                    },
                    {
                        "text": "üí∞ –ë–∞–ª–∞–Ω—Å",
                        "action_id": "employee.show_coins_balance"
                    }
                ]
            ]
        },
        "metrics_actions": {
            "type": "inline_keyboard",
            "layout": [
                [
                    {
                        "text": "‚ùì –ü–æ—á–µ–º—É —É–ø–∞–ª–æ",
                        "action_id": "employee.explain_metric_drop"
                    }
                ],
                [
                    {
                        "text": "üéØ –§–æ–∫—É—Å",
                        "action_id": "utility.focus_mode"
                    },
                    {
                        "text": "ü§ù –ü–æ–º–æ—â—å",
                        "action_id": "utility.request_help"
                    }
                ]
            ]
        },
        "emotional_support_actions": {
            "type": "inline_keyboard",
            "layout": [
                [
                    {
                        "text": "üéØ –§–æ–∫—É—Å-—Ä–µ–∂–∏–º",
                        "action_id": "utility.focus_mode"
                    }
                ],
                [
                    {
                        "text": "ü§ù –ó–∞–ø—Ä–æ—Å–∏—Ç—å –ø–æ–º–æ—â—å",
                        "action_id": "utility.request_help"
                    },
                    {
                        "text": "‚è∏ –ü–µ—Ä–µ—Ä—ã–≤",
                        "action_id": "utility.take_break"
                    }
                ]
            ]
        },
        "focus_mode_ack": {
            "type": "inline_keyboard",
            "layout": [
                [
                    {
                        "text": "‚è± 30 –º–∏–Ω",
                        "action_id": "utility.focus_30"
                    },
                    {
                        "text": "‚è± 60 –º–∏–Ω",
                        "action_id": "utility.focus_60"
                    }
                ],
                [
                    {
                        "text": "‚ùå –û—Ç–º–µ–Ω–∏—Ç—å",
                        "action_id": "utility.cancel_focus"
                    }
                ]
            ]
        },
        "simple_back": {
            "type": "inline_keyboard",
            "layout": [
                [
                    {
                        "text": "‚¨ÖÔ∏è –ù–∞–∑–∞–¥",
                        "action_id": "utility.go_back"
                    }
                ]
            ]
        }
    }
}